{
  "schema_version": "1.1",
  "id": "lecture",
  "clock_asset_id": "stream-main",
  "clock_track": "presentation",
  "duration_ms": 20000,
  "cues": [
    {
      "id": "cue-0000",
      "at_ms": 0,
      "scene": {
        "boards": {
          "demo": {
            "game_id": "main",
            "node_id": "n0",
            "orientation": "white",
            "overlays": [
              {
                "id": "ov-key-d4",
                "kind": "square",
                "square": "d4",
                "color": "#33aa5580",
                "end_ms": 4000
              }
            ]
          }
        },
        "captions": [
          {
            "lang": "en",
            "placement": "pre",
            "text": "White to move: shoulder the king before pushing the pawn."
          }
        ]
      }
    },
    {
      "id": "cue-0001",
      "at_ms": 5000,
      "scene": {
        "boards": {
          "demo": {
            "game_id": "main",
            "node_id": "n1",
            "orientation": "white",
            "overlays": [
              {
                "id": "ov-ar-kd4",
                "kind": "arrow",
                "from": "e3",
                "to": "d4",
                "color": "#33aa55ff"
              }
            ]
          }
        },
        "captions": [
          {
            "lang": "en",
            "placement": "post",
            "text": "1.Kd4! seizes a key square."
          }
        ]
      }
    },
    {
      "id": "cue-0002",
      "at_ms": 12000,
      "scene": {
        "boards": {
          "demo": {
            "game_id": "main",
            "node_id": "n1_blunder",
            "orientation": "white",
            "overlays": []
          }
        },
        "captions": [
          {
            "lang": "en",
            "placement": "post",
            "text": "Why 1.e5? fails to win."
          }
        ]
      }
    }
  ],
  "chapters": [
    {
      "id": "ch-1",
      "title": "Key Squares",
      "at_ms": 0
    }
  ],
  "interactive_triggers": [
    {
      "id": "trig-start-drill",
      "fen": "8/8/4k3/8/4P3/4K3/8/8 w - - 0 1",
      "match_mode": "board_turn",
      "game_id": "main",
      "node_id": "n0",
      "at_ms": 0,
      "kind": "range",
      "asset_id": "stream-main",
      "start_ms": 0,
      "end_ms": 5000,
      "prompt": "Find the winning king move for White.",
      "branches": [
        {
          "id": "br-kd4",
          "uci": "e3d4",
          "san": "Kd4",
          "role": "primary",
          "asset_id": "stream-main",
          "start_ms": 5000,
          "end_ms": 12000,
          "overlay_arrow": {
            "from": "e3",
            "to": "d4"
          }
        },
        {
          "id": "br-e5",
          "uci": "e4e5",
          "san": "e5",
          "role": "alternative",
          "asset_id": "stream-main",
          "start_ms": 12000,
          "end_ms": 20000,
          "overlay_arrow": {
            "from": "e4",
            "to": "e5"
          }
        }
      ]
    }
  ]
}
